{
  "meta": {
    "slug": "gloski-szumiace",
    "tytul": "Głoska Sz, Ż, Cz krok po kroku",
    "podtytul": "Zestaw ćwiczeń logopedycznych",
    "archetyp": "PROGRAM",
    "wersja": "1.0",
    "wiek": "4–8 lat",
    "kategoria": "logopedia",
    "podkategoria": "szumiace",
    "strony_deklarowane": 132,
    "min_pt_dziecka": 14
  },
  "wstep": {
    "warunek_wejscia": "Dziecko potrafi naśladować ruch języka pokazany przez dorosłego i wytrzymuje pięć minut ćwiczeń.",
    "obietnica": "Dziecko przechodzi pełną ścieżkę dla Sz, Ż i Cz: od ustawienia języka, przez sylaby i wyrazy, po zdania.",
    "ile_czasu_dziennie": "5–10 minut dziennie, sześć dni w tygodniu. Krótko i codziennie działa lepiej niż raz a długo.",
    "jak_korzystac": [
      "Drukuj po jednym tygodniu naraz, nie cały plik. Sześć albo siedem stron, w poniedziałek rano.",
      "Zacznij od karty rodzica. Zajmuje minutę i mówi, co robić przez cały tydzień.",
      "Usiądźcie obok siebie, nie naprzeciw. Dziecko ma widzieć twoją buzię z tej samej strony co swoją w lustrze.",
      "Najpierw pokazujesz ty, potem prosisz dziecko. Nigdy odwrotnie.",
      "Rób jedną stronę dziennie. Dwie, jeśli dziecko chce — nigdy więcej.",
      "Grę zostaw na koniec tygodnia. Działa jako nagroda i jako powtórka.",
      "Nie przechodź dalej, dopóki nie zgadza się warunek z rubryki „kiedy dalej”.",
      "Jeśli tydzień nie wyszedł, powtórz go. Program nie ma terminu."
    ],
    "czego_nie_robi": [
      "To nie jest terapia ani diagnoza. To ćwiczenia do zrobienia w domu.",
      "Nie zastępuje wizyty u logopedy — pozwala nie stać w miejscu, czekając na termin.",
      "Nie mówi, czy wymowa twojego dziecka jest na czas. Tego nie da się ocenić z kartki.",
      "Nie nadaje się dla dziecka, które ma inaczej zbudowany aparat mowy. To ogląda się na żywo, u specjalisty.",
      "Nie zawiera nagrań ani filmów. Wszystkie instrukcje są opisane słowami.",
      "Nie zadziała w tydzień. Dwanaście tygodni to minimum, nie obietnica."
    ],
    "kiedy_do_specjalisty": "Umów się do logopedy, jeśli dziecko nie unosi języka do góry, jeśli mówi przez nos, jeśli ślini się przy ćwiczeniach albo jeśli po czterech tygodniach nie słyszysz żadnej zmiany. Zrób to też wtedy, gdy dziecko przestaje chcieć mówić przy tobie. To nie znaczy, że robisz coś źle. Znaczy, że warto, żeby ktoś obejrzał buzię dziecka na żywo."
  },
  "tygodnie": [
    {
      "nr": 1,
      "cel": "W tym tygodniu dziecko ustawia język do SZ i mówi długie szszsz bez wyrazów.",
      "poziom_trudnosci": 1,
      "nowy_material": {
        "litery": [
          "SZ"
        ],
        "sylaby": [
          "SZ"
        ],
        "opis": "Samo ustawienie buzi i sama głoska SZ. Żadnych sylab i żadnych wyrazów."
      },
      "powtorka": {
        "z_tygodni": []
      },
      "material_dziecka": [
        {
          "id": "t1-ustawienie",
          "typ": "sylaby_sciezka",
          "polecenie": "Zrób pięć kroków po kolei.",
          "dane": {
            "kroki": [
              "Złóż zęby razem.",
              "Unieś język do góry.",
              "Zaokrąglij usta jak do U.",
              "Dmuchnij ciepło: szszsz.",
              "Policz do pięciu."
            ],
            "meta": "SZ"
          },
          "dla_rodzica": "Usiądź obok dziecka, nie naprzeciw. Rób każdy krok razem z nim."
        },
        {
          "id": "t1-waz",
          "typ": "sylaby_tabela",
          "polecenie": "Mów tak długo, jak widzisz.",
          "dane": {
            "wiersze": [
              [
                "SZ",
                "SZSZ",
                "SZSZSZ"
              ],
              [
                "SZSZSZSZ",
                "SZSZ",
                "SZ"
              ]
            ]
          },
          "dla_rodzica": "Im dłuższy zapis, tym dłuższy wydech. Nie przerywaj dziecku w połowie."
        },
        {
          "id": "t1-sz-czy-s",
          "typ": "wybierz_wyraz",
          "polecenie": "Zakreśl to, co słyszysz.",
          "dane": {
            "pozycje": [
              {
                "podpowiedz_rodzica": "Powiedz: szszsz.",
                "opcje": [
                  "SZ",
                  "S"
                ],
                "poprawna": 0
              },
              {
                "podpowiedz_rodzica": "Powiedz: sssss.",
                "opcje": [
                  "SZ",
                  "S"
                ],
                "poprawna": 1
              },
              {
                "podpowiedz_rodzica": "Powiedz: szszsz.",
                "opcje": [
                  "S",
                  "SZ"
                ],
                "poprawna": 1
              },
              {
                "podpowiedz_rodzica": "Powiedz: sssss.",
                "opcje": [
                  "S",
                  "SZ"
                ],
                "poprawna": 0
              },
              {
                "podpowiedz_rodzica": "Powiedz: szszsz.",
                "opcje": [
                  "SZ",
                  "S"
                ],
                "poprawna": 0
              },
              {
                "podpowiedz_rodzica": "Powiedz: sssss.",
                "opcje": [
                  "SZ",
                  "S"
                ],
                "poprawna": 1
              }
            ]
          },
          "dla_rodzica": "Mów z zakrytą buzią, żeby dziecko słuchało, a nie patrzyło."
        },
        {
          "id": "t1-gdzie-slychac",
          "typ": "wybierz_wyraz",
          "polecenie": "Zakreśl, gdzie słyszysz SZ.",
          "dane": {
            "pozycje": [
              {
                "podpowiedz_rodzica": "Mówię: szafa.",
                "opcje": [
                  "POCZĄTEK",
                  "KONIEC"
                ],
                "poprawna": 0
              },
              {
                "podpowiedz_rodzica": "Mówię: kosz.",
                "opcje": [
                  "POCZĄTEK",
                  "KONIEC"
                ],
                "poprawna": 1
              },
              {
                "podpowiedz_rodzica": "Mówię: szalik.",
                "opcje": [
                  "POCZĄTEK",
                  "KONIEC"
                ],
                "poprawna": 0
              },
              {
                "podpowiedz_rodzica": "Mówię: mysz.",
                "opcje": [
                  "POCZĄTEK",
                  "KONIEC"
                ],
                "poprawna": 1
              },
              {
                "podpowiedz_rodzica": "Mówię: szyba.",
                "opcje": [
                  "POCZĄTEK",
                  "KONIEC"
                ],
                "poprawna": 0
              },
              {
                "podpowiedz_rodzica": "Mówię: nasz.",
                "opcje": [
                  "POCZĄTEK",
                  "KONIEC"
                ],
                "poprawna": 1
              }
            ]
          },
          "dla_rodzica": "Czytasz ty. Dziecko tylko słucha i pokazuje palcem."
        },
        {
          "id": "t1-po-sladzie",
          "typ": "pisanie_sylab",
          "polecenie": "Napisz po śladzie.",
          "dane": {
            "wzory": [
              "SZ"
            ],
            "linie_na_wzor": 3,
            "liniatura": "trzylinia"
          },
          "dla_rodzica": "Dla młodszego dziecka wystarczy palec po śladzie, bez ołówka."
        },
        {
          "id": "t1-narysuj",
          "typ": "ramka_rysunkowa",
          "polecenie": "Narysuj to, co szumi.",
          "dane": {
            "wyrazy": [
              "WĄŻ",
              "WIATR",
              "WODA"
            ],
            "wysokosc_ramki_mm": 55
          },
          "dla_rodzica": "Przeczytaj wyraz dziecku. Po rysunku poproś o długie szszsz."
        },
        {
          "id": "t1-lustro",
          "typ": "formularz",
          "polecenie": "Zaznacz, co dziś wyszło.",
          "dane": {
            "pola": [
              {
                "etykieta": "Zęby złożone razem",
                "wysokosc_mm": 14,
                "linie": 1
              },
              {
                "etykieta": "Język uniesiony do góry",
                "wysokosc_mm": 14,
                "linie": 1
              },
              {
                "etykieta": "Usta zaokrąglone jak do U",
                "wysokosc_mm": 14,
                "linie": 1
              },
              {
                "etykieta": "Długie szszsz na jednym wydechu",
                "wysokosc_mm": 14,
                "linie": 1
              },
              {
                "etykieta": "Pięć powtórzeń pod rząd",
                "wysokosc_mm": 14,
                "linie": 1
              }
            ]
          },
          "dla_rodzica": "Rubryki są puste. Wypełniaj je ołówkiem, przy lustrze, razem z dzieckiem."
        }
      ],
      "gra": {
        "nazwa": "Długi wąż",
        "cel": "Wydłużyć wydech na głosce SZ.",
        "gracze": "dziecko i dorosły",
        "czas_min": 5,
        "przygotowanie": [
          "Wytnij pasek z falą z dołu strony.",
          "Połóż go na stole między wami."
        ],
        "zasady": [
          "Prowadzisz palcem po fali i mówisz szszsz bez przerwy.",
          "Kto dojedzie dalej na jednym wydechu, bierze pasek do siebie.",
          "Gracie pięć rund. Po każdej rundzie zamieniacie się kolejnością.",
          "Przerwany wydech kończy przejazd. Nikt nikogo nie poprawia w trakcie."
        ],
        "elementy_do_wyciecia": [
          "pasek z falą",
          "dwa znaczniki startu"
        ]
      },
      "czytanka": {
        "tytul": "Kto szumi",
        "czyta": "rodzic",
        "linie": [
          "Wąż leży w trawie.",
          "Wąż mówi: szszsz.",
          "Wiatr wieje w lesie.",
          "Liście mówią: szszsz.",
          "Woda leci z kranu.",
          "Woda mówi: szszsz.",
          "Mama prosi o ciszę.",
          "Mama mówi: szszsz."
        ],